adult,backdrop_path,belongs_to_collection,budget,genres,homepage,id,imdb_id,origin_country,original_language,original_title,overview,popularity,poster_path,production_companies,production_countries,release_date,revenue,runtime,spoken_languages,status,tagline,title,video,vote_average,vote_count,belongs_to_collection.id,belongs_to_collection.name,belongs_to_collection.poster_path,belongs_to_collection.backdrop_path
False,/8lBViysvNJBPkl6zG1LVAaW3qhj.jpg,,245000000,"[{'id': 28, 'name': 'Action'}, {'id': 12, 'name': 'Adventure'}, {'id': 53, 'name': 'Thriller'}]",https://www.mgm.com/movies/spectre,206647,tt2379713,['GB'],en,Spectre,"A cryptic message from Bond’s past sends him on a trail to uncover a sinister organization. While M battles political forces to keep the secret service alive, Bond peels back the layers of deceit to reveal the terrible truth behind SPECTRE.",40.583,/aD8fQF2WFAvMMxmMHHj2RXz2hwP.jpg,"[{'id': 21, 'logo_path': '/usUnaYV6hQnlVAXP6r4HwrlLFPG.png', 'name': 'Metro-Goldwyn-Mayer', 'origin_country': 'US'}, {'id': 5, 'logo_path': '/71BqEFAF4V3qjjMPCpLuyJFB9A.png', 'name': 'Columbia Pictures', 'origin_country': 'US'}, {'id': 7576, 'logo_path': '/oYcUi1byZ312Z3xiz5ojz9RQLND.png', 'name': 'EON Productions', 'origin_country': 'GB'}, {'id': 10761, 'logo_path': None, 'name': 'Danjaq', 'origin_country': 'US'}, {'id': 69434, 'logo_path': None, 'name': 'B24', 'origin_country': 'GB'}]","[{'iso_3166_1': 'GB', 'name': 'United Kingdom'}, {'iso_3166_1': 'US', 'name': 'United States of America'}]",2015-10-26,880707597,148,"[{'english_name': 'French', 'iso_639_1': 'fr', 'name': 'Français'}, {'english_name': 'English', 'iso_639_1': 'en', 'name': 'English'}, {'english_name': 'Spanish', 'iso_639_1': 'es', 'name': 'Español'}, {'english_name': 'Italian', 'iso_639_1': 'it', 'name': 'Italiano'}, {'english_name': 'German', 'iso_639_1': 'de', 'name': 'Deutsch'}]",Released,,Spectre,False,6.551,10505,645.0,James Bond Collection,/ofwSiqOFShhunAIYYdSMHMJQSx2.jpg,/rggeBvlUAww5ggjpjJ8fWbbdA0s.jpg
False,/qUq3QTr2KLvGIcN0GaaaYx9bbyH.jpg,,3000000,"[{'id': 18, 'name': 'Drama'}]",,510,tt0073486,['US'],en,One Flew Over the Cuckoo's Nest,"A petty criminal fakes insanity to serve his sentence in a mental ward rather than prison. He soon finds himself as a leader to the other patients—and an enemy to the cruel, domineering nurse who runs the ward.",44.414,/kjWsMh72V6d8KRLV4EOoSJLT1H7.jpg,"[{'id': 286, 'logo_path': None, 'name': 'Fantasy Films', 'origin_country': ''}, {'id': 60, 'logo_path': '/4YldLvCWQL9VIAHQ2Fu3Ffkh9Si.png', 'name': 'United Artists', 'origin_country': 'US'}]","[{'iso_3166_1': 'US', 'name': 'United States of America'}]",1975-11-19,108981275,133,"[{'english_name': 'English', 'iso_639_1': 'en', 'name': 'English'}]",Released,"If he's crazy, what does that make you?",One Flew Over the Cuckoo's Nest,False,8.414,10496,,,,
False,/3nYlM34QhzdtAvWRV5bN4nLtnTc.jpg,,7000000,"[{'id': 27, 'name': 'Horror'}, {'id': 53, 'name': 'Thriller'}, {'id': 12, 'name': 'Adventure'}]",https://www.uphe.com/movies/jaws,578,tt0073195,['US'],en,Jaws,"When the seaside community of Amity finds itself under attack by a dangerous great white shark, the town's chief of police, a young marine biologist, and a grizzled hunter embark on a desperate quest to destroy the beast before it strikes again.",53.189,/lxM6kqilAdpdhqUl2biYp5frUxE.jpg,"[{'id': 1865, 'logo_path': None, 'name': 'The Zanuck/Brown Company', 'origin_country': 'US'}, {'id': 33, 'logo_path': '/3wwjVpkZtnog6lSKzWDjvw2Yi00.png', 'name': 'Universal Pictures', 'origin_country': 'US'}]","[{'iso_3166_1': 'US', 'name': 'United States of America'}]",1975-06-20,470653000,124,"[{'english_name': 'English', 'iso_639_1': 'en', 'name': 'English'}]",Released,The terrifying motion picture from the terrifying No.1 best seller.,Jaws,False,7.7,10493,2366.0,Jaws Collection,/fgraZdDCvAtBr0MHczmL6raonHd.jpg,/1e2QvI2u7Q4d2admK6Xw0AjLjVp.jpg
False,/rQaHA74pevnGsxcKGaoZVGWe9TC.jpg,,150000000,"[{'id': 16, 'name': 'Animation'}, {'id': 10751, 'name': 'Family'}, {'id': 35, 'name': 'Comedy'}, {'id': 14, 'name': 'Fantasy'}]",https://www.disneyplus.com/movies/soul/77zlWrb9vRYp,508442,tt2948372,['US'],en,Soul,"Joe Gardner is a middle school teacher with a love for jazz music. After a successful audition at the Half Note Club, he suddenly gets into an accident that separates his soul from his body and is transported to the You Seminar, a center in which souls develop and gain passions before being transported to a newborn child. Joe must enlist help from the other souls-in-training, like 22, a soul who has spent eons in the You Seminar, in order to get back to Earth.",68.301,/c2ELoYcSis0HYMyDPGPfk8eVsen.jpg,"[{'id': 2, 'logo_path': '/wdrCwmRnLFJhEoH8GSfymY85KHT.png', 'name': 'Walt Disney Pictures', 'origin_country': 'US'}, {'id': 3, 'logo_path': '/1TjvGVDMYsj6JBxOAkUHpPEwLf7.png', 'name': 'Pixar', 'origin_country': 'US'}]","[{'iso_3166_1': 'US', 'name': 'United States of America'}]",2020-12-25,121977511,101,"[{'english_name': 'English', 'iso_639_1': 'en', 'name': 'English'}]",Released,Everybody has a soul. Joe Gardner is about to find his.,Soul,False,8.12,10483,,,,
False,/aGmsekNU5cMOkJMpbdRutkvmVMl.jpg,,80000000,"[{'id': 35, 'name': 'Comedy'}]",http://hangoverpart2.warnerbros.com/,45243,tt1411697,['US'],en,The Hangover Part II,"The Hangover crew heads to Thailand for Stu's wedding. After the disaster of a bachelor party in Las Vegas last year, Stu is playing it safe with a mellow pre-wedding brunch. However, nothing goes as planned and Bangkok is the perfect setting for another adventure with the rowdy group.",58.1,/7sGkjqorTHkaHTz8Q4WWHj8JL9t.jpg,"[{'id': 923, 'logo_path': '/8M99Dkt23MjQMTTWukq4m5XsEuo.png', 'name': 'Legendary Pictures', 'origin_country': 'US'}, {'id': 3527, 'logo_path': None, 'name': 'Green Hat Films', 'origin_country': 'US'}, {'id': 174, 'logo_path': '/zhD3hhtKB5qyv7ZeL4uLpNxgMVU.png', 'name': 'Warner Bros. Pictures', 'origin_country': 'US'}]","[{'iso_3166_1': 'US', 'name': 'United States of America'}]",2011-05-25,586764305,102,"[{'english_name': 'English', 'iso_639_1': 'en', 'name': 'English'}, {'english_name': 'Thai', 'iso_639_1': 'th', 'name': 'ภาษาไทย'}]",Released,The Wolfpack Is Back,The Hangover Part II,False,6.483,10461,86119.0,The Hangover Collection,/x8D6HXhmvdtPhM219J5Rc6ESagr.jpg,/3DFkmPwHEMUEkQzETXvUQH3314N.jpg
False,/qb6WoLJ9YtfhV7pgsTfUDlRYaCH.jpg,,13000000,"[{'id': 18, 'name': 'Drama'}]",https://www.lionsgate.com/movies/the-perks-of-being-a-wallflower,84892,tt1659337,['US'],en,The Perks of Being a Wallflower,"Pittsburgh, Pennsylvania, 1991. High school freshman Charlie is a wallflower, always watching life from the sidelines, until two senior students, Sam and her stepbrother Patrick, become his mentors, helping him discover the joys of friendship, music and love.",40.447,/aKCvdFFF5n80P2VdS7d8YBwbCjh.jpg,"[{'id': 2130, 'logo_path': '/g0lqeY2FvhzXcOI6z8RVXbORRUY.png', 'name': 'Mr. Mudd', 'origin_country': 'US'}]","[{'iso_3166_1': 'US', 'name': 'United States of America'}]",2012-09-20,33384127,103,"[{'english_name': 'English', 'iso_639_1': 'en', 'name': 'English'}]",Released,We are infinite.,The Perks of Being a Wallflower,False,7.8,10458,,,,
False,/jks6QgJjsaDC5iT6bxLsSS0eo6L.jpg,,185000000,"[{'id': 28, 'name': 'Action'}, {'id': 12, 'name': 'Adventure'}, {'id': 14, 'name': 'Fantasy'}]",http://kongskullislandmovie.com/,293167,tt3731562,['US'],en,Kong: Skull Island,"Explore the mysterious and dangerous home of the king of the apes as a team of explorers ventures deep inside the treacherous, primordial island.",42.482,/r2517Vz9EhDhj88qwbDVj8DCRZN.jpg,"[{'id': 923, 'logo_path': '/8M99Dkt23MjQMTTWukq4m5XsEuo.png', 'name': 'Legendary Pictures', 'origin_country': 'US'}, {'id': 81620, 'logo_path': '/7LkIVuWBVScdujpKhBPx1TMnPQE.png', 'name': 'Tencent Pictures', 'origin_country': 'CN'}]","[{'iso_3166_1': 'CN', 'name': 'China'}, {'iso_3166_1': 'US', 'name': 'United States of America'}]",2017-03-08,566652812,118,"[{'english_name': 'English', 'iso_639_1': 'en', 'name': 'English'}, {'english_name': 'Vietnamese', 'iso_639_1': 'vi', 'name': 'Tiếng Việt'}]",Released,All hail the king,Kong: Skull Island,False,6.545,10436,,,,
False,/lqGqvmqHr8T2Ll8w7mzAtNshUpb.jpg,,185000000,"[{'id': 80, 'name': 'Crime'}, {'id': 9648, 'name': 'Mystery'}, {'id': 53, 'name': 'Thriller'}]",https://www.thebatman.com,414906,tt1877830,['US'],en,The Batman,"In his second year of fighting crime, Batman uncovers corruption in Gotham City that connects to his own family while facing a serial killer known as the Riddler.",137.588,/74xTEgt7R36Fpooo50r9T25onhq.jpg,"[{'id': 101405, 'logo_path': '/iusVPF9AJD1DiHEWbZEXgn1hpOf.png', 'name': '6th & Idaho Motion Picture Company', 'origin_country': 'US'}, {'id': 119245, 'logo_path': '/6F45uVsKpNYANcWvplyhgIFezFU.png', 'name': 'Dylan Clark Productions', 'origin_country': 'US'}, {'id': 128064, 'logo_path': '/13F3Jf7EFAcREU0xzZqJnVnyGXu.png', 'name': 'DC Films', 'origin_country': 'US'}, {'id': 174, 'logo_path': '/zhD3hhtKB5qyv7ZeL4uLpNxgMVU.png', 'name': 'Warner Bros. Pictures', 'origin_country': 'US'}]","[{'iso_3166_1': 'US', 'name': 'United States of America'}]",2022-03-01,771000000,177,"[{'english_name': 'English', 'iso_639_1': 'en', 'name': 'English'}]",Released,Unmask the truth.,The Batman,False,7.7,10425,948485.0,The Batman Collection,/jauF9NsYc97khPSENLLHGXT09bg.jpg,/6IX81STHKPsSFVCN57sJ3ljwXI5.jpg
False,/7S7PE3vK9Eh5uzCYBDGk5qTJeYW.jpg,,6000000,"[{'id': 18, 'name': 'Drama'}, {'id': 80, 'name': 'Crime'}, {'id': 53, 'name': 'Thriller'}]",http://www.mgm.com/#/our-titles/2083/The-Usual-Suspects,629,tt0114814,['US'],en,The Usual Suspects,"Held in an L.A. interrogation room, Verbal Kint attempts to convince the feds that a mythic crime lord, Keyser Soze, not only exists, but was also responsible for drawing him and his four partners into a multi-million dollar heist that ended with an explosion in San Pedro harbor – leaving few survivors. Verbal lures his interrogators with an incredible story of the crime lord's almost supernatural prowess.",43.048,/rWbsxdwF9qQzpTPCLmDfVnVqTK1.jpg,"[{'id': 9168, 'logo_path': '/hQNXrYIuyLRxMSBuGHk0GX7CCBS.png', 'name': 'Bad Hat Harry Productions', 'origin_country': 'US'}, {'id': 361, 'logo_path': None, 'name': 'Blue Parrot Productions', 'origin_country': ''}]","[{'iso_3166_1': 'US', 'name': 'United States of America'}]",1995-07-19,23300000,106,"[{'english_name': 'Spanish', 'iso_639_1': 'es', 'name': 'Español'}, {'english_name': 'English', 'iso_639_1': 'en', 'name': 'English'}, {'english_name': 'French', 'iso_639_1': 'fr', 'name': 'Français'}, {'english_name': 'Hungarian', 'iso_639_1': 'hu', 'name': 'Magyar'}]",Released,Five criminals. One line up. No coincidence.,The Usual Suspects,False,8.177,10414,,,,
False,/iFaWUETEE2umP1WY0LUAmjSpzm7.jpg,,110000000,"[{'id': 28, 'name': 'Action'}, {'id': 35, 'name': 'Comedy'}, {'id': 18, 'name': 'Drama'}, {'id': 53, 'name': 'Thriller'}]",,787,tt0356910,['US'],en,Mr. & Mrs. Smith,"After five (or six) years of vanilla-wedded bliss, ordinary suburbanites John and Jane Smith are stuck in a huge rut. Unbeknownst to each other, they are both coolly lethal, highly-paid assassins working for rival organisations. When they discover they're each other's next target, their secret lives collide in a spicy, explosive mix of wicked comedy, pent-up passion, nonstop action and high-tech weaponry.",46.053,/wzIO3ytxeSNt1wRpXLIdkNbGoDm.jpg,"[{'id': 508, 'logo_path': '/7cxRWzi4LsVm4Utfpr1hfARNurT.png', 'name': 'Regency Enterprises', 'origin_country': 'US'}, {'id': 10104, 'logo_path': '/wRn5HnYMGeJHmItRypgOZOC6gwY.png', 'name': 'New Regency Pictures', 'origin_country': 'US'}, {'id': 491, 'logo_path': '/5LvDUt3KmvRnXQ4NrdWJYHeuA8J.png', 'name': 'Summit Entertainment', 'origin_country': 'US'}, {'id': 433, 'logo_path': '/iafkKMpcRfEXq9a4sQf0h6tg2E2.png', 'name': 'Weed Road Pictures', 'origin_country': 'US'}, {'id': 1171, 'logo_path': '/wp7NwsxxHT8sqPaek6SlxnXlkP4.png', 'name': 'Epsilon Motion Pictures', 'origin_country': 'CH'}]","[{'iso_3166_1': 'CH', 'name': 'Switzerland'}, {'iso_3166_1': 'US', 'name': 'United States of America'}]",2005-06-07,487300000,119,"[{'english_name': 'English', 'iso_639_1': 'en', 'name': 'English'}, {'english_name': 'Spanish', 'iso_639_1': 'es', 'name': 'Español'}]",Released,'Til death do us part.,Mr. & Mrs. Smith,False,6.688,10378,,,,
False,/4mcOCiR06dqQ5eoEJcG3zvonjOa.jpg,,61000000,"[{'id': 878, 'name': 'Science Fiction'}, {'id': 28, 'name': 'Action'}, {'id': 53, 'name': 'Thriller'}, {'id': 12, 'name': 'Adventure'}]",https://www.20thcenturystudios.com/movies/maze-runner-the-scorch-trials,294254,tt4046784,['US'],en,Maze Runner: The Scorch Trials,"Thomas and his fellow Gladers face their greatest challenge yet: searching for clues about the mysterious and powerful organization known as WCKD. Their journey takes them to the Scorch, a desolate landscape filled with unimaginable obstacles. Teaming up with resistance fighters, the Gladers take on WCKD’s vastly superior forces and uncover its shocking plans for them all.",70.379,/mYw7ZyejqSCPFlrT2jHZOESZDU3.jpg,"[{'id': 12292, 'logo_path': '/4GQTeqos2luopEtp3OgMQYusQ5c.png', 'name': 'Temple Hill Entertainment', 'origin_country': 'US'}, {'id': 3672, 'logo_path': '/xpRwVe9NL5791oyUidzeRp8ezGj.png', 'name': 'The Gotham Group', 'origin_country': 'US'}, {'id': 22213, 'logo_path': '/qx9K6bFWJupwde0xQDwOvXkOaL8.png', 'name': 'TSG Entertainment', 'origin_country': 'US'}, {'id': 25, 'logo_path': '/qZCc1lty5FzX30aOCVRBLzaVmcp.png', 'name': '20th Century Fox', 'origin_country': 'US'}]","[{'iso_3166_1': 'US', 'name': 'United States of America'}]",2015-09-09,312296056,131,"[{'english_name': 'English', 'iso_639_1': 'en', 'name': 'English'}]",Released,The Maze Was Just the Beginning.,Maze Runner: The Scorch Trials,False,6.732,10373,295130.0,The Maze Runner Collection,/beR71cbwXH0vySlTMPZo0GQ54Q9.jpg,/9BX8MUXmOa9i7oyTMx9OmbzkLev.jpg
False,/eVHVwP71el20fofkCHo78ebQv7Q.jpg,,104000000,"[{'id': 28, 'name': 'Action'}, {'id': 12, 'name': 'Adventure'}, {'id': 35, 'name': 'Comedy'}]",http://www.foxmovies.com/movies/kingsman-the-golden-circle,343668,tt4649466,"['GB', 'US']",en,Kingsman: The Golden Circle,"When an attack on the Kingsman headquarters takes place and a new villain rises, Eggsy and Merlin are forced to work together with the American agency known as the Statesman to save the world.",64.799,/34xBL6BXNYFqtHO9zhcgoakS4aP.jpg,"[{'id': 25, 'logo_path': '/qZCc1lty5FzX30aOCVRBLzaVmcp.png', 'name': '20th Century Fox', 'origin_country': 'US'}, {'id': 5374, 'logo_path': '/pMUiImmYANjZUlZFiZMWziQDSs6.png', 'name': 'Marv', 'origin_country': 'GB'}, {'id': 78995, 'logo_path': None, 'name': 'Cloudy Productions', 'origin_country': 'GB'}, {'id': 22213, 'logo_path': '/qx9K6bFWJupwde0xQDwOvXkOaL8.png', 'name': 'TSG Entertainment', 'origin_country': 'US'}]","[{'iso_3166_1': 'GB', 'name': 'United Kingdom'}, {'iso_3166_1': 'US', 'name': 'United States of America'}]",2017-09-20,410902662,141,"[{'english_name': 'Swedish', 'iso_639_1': 'sv', 'name': 'svenska'}, {'english_name': 'English', 'iso_639_1': 'en', 'name': 'English'}, {'english_name': 'Italian', 'iso_639_1': 'it', 'name': 'Italiano'}]",Released,A proper spy movie.,Kingsman: The Golden Circle,False,6.966,10370,391860.0,Kingsman Collection,/iR8L2XHA72wmYHc6O8LZmwV5hd5.jpg,/esDXPeq4eBLI5uIWH9QiyHkCUBB.jpg
False,/vIgyYkXkg6NC2whRbYjBD7eb3Er.jpg,,110000000,"[{'id': 878, 'name': 'Science Fiction'}, {'id': 28, 'name': 'Action'}, {'id': 12, 'name': 'Adventure'}]",https://www.venom.movie,580489,tt7097896,['US'],en,Venom: Let There Be Carnage,"After finding a host body in investigative reporter Eddie Brock, the alien symbiote must face a new enemy, Carnage, the alter ego of serial killer Cletus Kasady.",188.54,/pzKsRuKLFmYrW5Q0q8E8G78Tcgo.jpg,"[{'id': 5, 'logo_path': '/71BqEFAF4V3qjjMPCpLuyJFB9A.png', 'name': 'Columbia Pictures', 'origin_country': 'US'}, {'id': 84041, 'logo_path': '/nw4kyc29QRpNtFbdsBHkRSFavvt.png', 'name': 'Pascal Pictures', 'origin_country': 'US'}, {'id': 53462, 'logo_path': '/nx8B3Phlcse02w86RW4CJqzCnfL.png', 'name': 'Matt Tolmach Productions', 'origin_country': 'US'}, {'id': 14439, 'logo_path': None, 'name': 'Arad Productions', 'origin_country': 'US'}]","[{'iso_3166_1': 'US', 'name': 'United States of America'}]",2021-09-30,506863592,97,"[{'english_name': 'English', 'iso_639_1': 'en', 'name': 'English'}, {'english_name': 'Spanish', 'iso_639_1': 'es', 'name': 'Español'}]",Released,It’s time to meet Carnage.,Venom: Let There Be Carnage,False,6.795,10328,558216.0,Venom Collection,/aC1yeoBdQL0fukiKrEAFocJ572O.jpg,/vq340s8DxA5Q209FT8PHA6CXYOx.jpg
False,/80uHK2xWwjlOxmfJ1wQB09omAht.jpg,,23000000,"[{'id': 10749, 'name': 'Romance'}, {'id': 35, 'name': 'Comedy'}, {'id': 80, 'name': 'Crime'}, {'id': 14, 'name': 'Fantasy'}]",,854,tt0110475,['US'],en,The Mask,"When timid bank clerk Stanley Ipkiss discovers a magical mask containing the spirit of the Norse god Loki, his entire life changes. While wearing the mask, Ipkiss becomes a supernatural playboy exuding charm and confidence which allows him to catch the eye of local nightclub singer Tina Carlyle. Unfortunately, under the mask's influence, Ipkiss also robs a bank, which angers junior crime lord Dorian Tyrell, whose goons get blamed for the heist.",75.659,/xbbXp9px4o8Oe7IbGd0yIbla8mZ.jpg,"[{'id': 552, 'logo_path': '/9dGdLfm3GteWeUDtD9c9tvlidUG.png', 'name': 'Dark Horse Entertainment', 'origin_country': 'US'}, {'id': 12, 'logo_path': '/2ycs64eqV5rqKYHyQK0GVoKGvfX.png', 'name': 'New Line Cinema', 'origin_country': 'US'}]","[{'iso_3166_1': 'US', 'name': 'United States of America'}]",1994-07-29,351583407,101,"[{'english_name': 'Swedish', 'iso_639_1': 'sv', 'name': 'svenska'}, {'english_name': 'English', 'iso_639_1': 'en', 'name': 'English'}]",Released,From zero to hero.,The Mask,False,6.958,10300,43072.0,The Mask Collection,/h0qeHjvUBb1J9J7fvRtVdfsy0qL.jpg,/ucDNm5TJW1ji7kIjnX2SZYm7ATM.jpg
False,/nVMalJRUsOeGP5xPx9ULmirZ4cJ.jpg,,125000000,"[{'id': 12, 'name': 'Adventure'}, {'id': 28, 'name': 'Action'}, {'id': 80, 'name': 'Crime'}, {'id': 9648, 'name': 'Mystery'}]",http://sherlockholmes2.warnerbros.com/index.html,58574,tt1515091,['US'],en,Sherlock Holmes: A Game of Shadows,"There is a new criminal mastermind at large (Professor Moriarty) and not only is he Holmes’ intellectual equal, but his capacity for evil and lack of conscience may give him an advantage over the  detective.",34.481,/y1MYZkwhZK6L0Jy4YMuPktzDOfn.jpg,"[{'id': 79, 'logo_path': '/at4uYdwAAgNRKhZuuFX8ShKSybw.png', 'name': 'Village Roadshow Pictures', 'origin_country': 'US'}, {'id': 1885, 'logo_path': '/xlvoOZr4s1PygosrwZyolIFe5xs.png', 'name': 'Silver Pictures', 'origin_country': 'US'}, {'id': 23202, 'logo_path': None, 'name': 'Wigram Productions', 'origin_country': 'US'}, {'id': 2723, 'logo_path': '/rB0dyszYRRR3SAG1tfNRzXoYDYq.png', 'name': 'Lin Pictures', 'origin_country': 'US'}]","[{'iso_3166_1': 'US', 'name': 'United States of America'}]",2011-11-22,334615000,129,"[{'english_name': 'English', 'iso_639_1': 'en', 'name': 'English'}]",Released,The game is afoot.,Sherlock Holmes: A Game of Shadows,False,7.14,10296,102322.0,Sherlock Holmes Collection,/oXzQIiGl3cZwF0R4Bq88Gf9fcMJ.jpg,/kT4Pz6QY29qHMVKULzNrVHg6Vwg.jpg
False,/5AhpUb8CAP0jZ4Wrn7AsRUYjZxB.jpg,,225000000,"[{'id': 28, 'name': 'Action'}, {'id': 35, 'name': 'Comedy'}, {'id': 878, 'name': 'Science Fiction'}]",http://www.sonypictures.com/movies/meninblack3/,41154,tt1409024,['US'],en,Men in Black 3,"Agents J and K are back...in time. J has seen some inexplicable things in his 15 years with the Men in Black, but nothing, not even aliens, perplexes him as much as his wry, reticent partner. But when K's life and the fate of the planet are put at stake, Agent J will have to travel back in time to put things right. J discovers that there are secrets to the universe that K never told him - secrets that will reveal themselves as he teams up with the young Agent K to save his partner, the agency, and the future of humankind.",38.718,/90DdoEStzeObs96fsYf4GG544iN.jpg,"[{'id': 5, 'logo_path': '/71BqEFAF4V3qjjMPCpLuyJFB9A.png', 'name': 'Columbia Pictures', 'origin_country': 'US'}, {'id': 9169, 'logo_path': '/fsjn4BwBzxlEBWmmWPOeBpubvOx.png', 'name': 'Hemisphere Media Capital', 'origin_country': 'US'}, {'id': 56, 'logo_path': '/cEaxANEisCqeEoRvODv2dO1I0iI.png', 'name': 'Amblin Entertainment', 'origin_country': 'US'}, {'id': 49325, 'logo_path': '/R05WCoCJcPWGSDaKaYgx3AeVuR.png', 'name': 'Parkes+MacDonald Image Nation', 'origin_country': 'US'}, {'id': 6736, 'logo_path': '/cdCAYeb3K3Ajhn1tfXHPSfT1KzB.png', 'name': 'Image Nation Abu Dhabi', 'origin_country': 'AE'}]","[{'iso_3166_1': 'AE', 'name': 'United Arab Emirates'}, {'iso_3166_1': 'US', 'name': 'United States of America'}]",2012-05-23,624000000,106,"[{'english_name': 'English', 'iso_639_1': 'en', 'name': 'English'}]",Released,Back in time.,Men in Black 3,False,6.5,10290,86055.0,Men In Black Collection,/neo50PMS8QZhl4VdzXAF1Cz3sPz.jpg,/xKz6YaOvmnIJQ3MYIpnaa7FBaAB.jpg
False,/awuUwOAGCPqC4mIDQmeKdPiiLR5.jpg,,250000000,"[{'id': 28, 'name': 'Action'}, {'id': 80, 'name': 'Crime'}, {'id': 53, 'name': 'Thriller'}]",https://www.uphe.com/movies/the-fate-of-the-furious,337339,tt4630562,['US'],en,The Fate of the Furious,"When a mysterious woman seduces Dom into the world of crime and a betrayal of those closest to him, the crew face trials that will test them as never before.",77.708,/dImWM7GJqryWJO9LHa3XQ8DD5NH.jpg,"[{'id': 333, 'logo_path': '/5xUJfzPZ8jWJUDzYtIeuPO4qPIa.png', 'name': 'Original Film', 'origin_country': 'US'}, {'id': 1225, 'logo_path': '/rIxhJMR7oK8b2fMakmTfRLY2TZv.png', 'name': 'One Race', 'origin_country': 'US'}, {'id': 33, 'logo_path': '/3wwjVpkZtnog6lSKzWDjvw2Yi00.png', 'name': 'Universal Pictures', 'origin_country': 'US'}]","[{'iso_3166_1': 'US', 'name': 'United States of America'}]",2017-04-12,1236000000,136,"[{'english_name': 'English', 'iso_639_1': 'en', 'name': 'English'}, {'english_name': 'Spanish', 'iso_639_1': 'es', 'name': 'Español'}]",Released,Never give up on family.,The Fate of the Furious,False,6.87,10274,9485.0,The Fast and the Furious Collection,/rKKSOVv6iU3nULrKQmd9uEx9gez.jpg,/z5A5W3WYJc3UVEWljSGwdjDgQ0j.jpg
False,/3zBjU7mXlzxJKAStRzlNDZRGT0m.jpg,,75000000,"[{'id': 28, 'name': 'Action'}, {'id': 80, 'name': 'Crime'}]",http://www.birdsofpreymovie.net,495764,tt7713068,['US'],en,Birds of Prey (and the Fantabulous Emancipation of One Harley Quinn),"Harley Quinn joins forces with a singer, an assassin and a police detective to help a young girl who had a hit placed on her after she stole a rare diamond from a crime lord.",48.359,/h4VB6m0RwcicVEZvzftYZyKXs6K.jpg,"[{'id': 174, 'logo_path': '/zhD3hhtKB5qyv7ZeL4uLpNxgMVU.png', 'name': 'Warner Bros. Pictures', 'origin_country': 'US'}, {'id': 128064, 'logo_path': '/13F3Jf7EFAcREU0xzZqJnVnyGXu.png', 'name': 'DC Films', 'origin_country': 'US'}, {'id': 82968, 'logo_path': '/gRROMOG5bpF6TIDMbfaa5gnFFzl.png', 'name': 'LuckyChap Entertainment', 'origin_country': 'US'}, {'id': 101831, 'logo_path': '/l6x0SkRVp9ksGgRhboZbkI9w7PM.png', 'name': 'Clubhouse Pictures', 'origin_country': 'US'}, {'id': 103462, 'logo_path': None, 'name': 'Kroll & Co Entertainment', 'origin_country': 'US'}]","[{'iso_3166_1': 'US', 'name': 'United States of America'}]",2020-02-05,205537933,109,"[{'english_name': 'English', 'iso_639_1': 'en', 'name': 'English'}]",Released,Mind Over Mayhem,Birds of Prey (and the Fantabulous Emancipation of One Harley Quinn),False,6.915,10260,,,,
False,/lxCUDgZ54myV7goBrkpFoHRt9Ms.jpg,,42000000,"[{'id': 28, 'name': 'Action'}, {'id': 35, 'name': 'Comedy'}, {'id': 80, 'name': 'Crime'}]",http://www.21jumpstreet-movie.com/,64688,tt1232829,['US'],en,21 Jump Street,"When cops Schmidt and Jenko join the secret Jump Street unit, they use their youthful appearances to go under cover as high-school students. They trade in their guns and badges for backpacks, and set out to shut down a dangerous drug ring. But, as time goes on, Schmidt and Jenko discover that high school is nothing like it was just a few years earlier -- and, what's more, they must again confront the teenage terror and anxiety they thought they had left behind.",33.212,/8v3Sqv9UcIUC4ebmpKWROqPBINZ.jpg,"[{'id': 5, 'logo_path': '/71BqEFAF4V3qjjMPCpLuyJFB9A.png', 'name': 'Columbia Pictures', 'origin_country': 'US'}, {'id': 7295, 'logo_path': '/5MYE96QiE5a5oFhXxFb4y8ILSpw.png', 'name': 'Relativity Media', 'origin_country': 'US'}, {'id': 333, 'logo_path': '/5xUJfzPZ8jWJUDzYtIeuPO4qPIa.png', 'name': 'Original Film', 'origin_country': 'US'}, {'id': 21, 'logo_path': '/usUnaYV6hQnlVAXP6r4HwrlLFPG.png', 'name': 'Metro-Goldwyn-Mayer', 'origin_country': 'US'}, {'id': 5585, 'logo_path': None, 'name': 'Stephen J. Cannell Productions', 'origin_country': 'US'}, {'id': 220798, 'logo_path': None, 'name': 'SJC Studios', 'origin_country': ''}]","[{'iso_3166_1': 'US', 'name': 'United States of America'}]",2012-03-14,201585328,109,"[{'english_name': 'English', 'iso_639_1': 'en', 'name': 'English'}]",Released,The only thing getting blown tonight is their cover.,21 Jump Street,False,6.883,10260,212562.0,Jump Street Collection,/of42UiM2j4MJQqso9To2ULM7hIP.jpg,/3fkhNqG2i6dlWZmjg100PFEpbWW.jpg
