adult,backdrop_path,belongs_to_collection,budget,genres,homepage,id,imdb_id,origin_country,original_language,original_title,overview,popularity,poster_path,production_companies,production_countries,release_date,revenue,runtime,spoken_languages,status,tagline,title,video,vote_average,vote_count,belongs_to_collection.id,belongs_to_collection.name,belongs_to_collection.poster_path,belongs_to_collection.backdrop_path
False,/skQN2UMQKQnOTmwplcYMx6ZF4jS.jpg,,40000000,"[{'id': 12, 'name': 'Adventure'}, {'id': 35, 'name': 'Comedy'}, {'id': 878, 'name': 'Science Fiction'}]",http://www.backtothefuture.com/movies/backtothefuture2,165,tt0096874,['US'],en,Back to the Future Part II,"Marty and Doc are at it again in this wacky sequel to the 1985 blockbuster as the time-traveling duo head to 2015 to nip some McFly family woes in the bud. But things go awry thanks to bully Biff Tannen and a pesky sports almanac. In a last-ditch attempt to set things straight, Marty finds himself bound for 1955 and face to face with his teenage parents -- again.",40.377,/hQq8xZe5uLjFzSBt4LanNP7SQjl.jpg,"[{'id': 33, 'logo_path': '/3wwjVpkZtnog6lSKzWDjvw2Yi00.png', 'name': 'Universal Pictures', 'origin_country': 'US'}, {'id': 56, 'logo_path': '/cEaxANEisCqeEoRvODv2dO1I0iI.png', 'name': 'Amblin Entertainment', 'origin_country': 'US'}]","[{'iso_3166_1': 'US', 'name': 'United States of America'}]",1989-11-22,332000000,108,"[{'english_name': 'English', 'iso_639_1': 'en', 'name': 'English'}]",Released,Getting back was only the beginning.,Back to the Future Part II,False,7.766,12798,264.0,Back to the Future Collection,/78z0WMBzBWOnCsXWulihPJKCToL.jpg,/c9C9Pg2QctyjZHRmS0P8rZg1OTA.jpg
False,/bgkFOoXEQMRjKkCvgoj7smdGbuh.jpg,,85000000,"[{'id': 28, 'name': 'Action'}, {'id': 12, 'name': 'Adventure'}, {'id': 878, 'name': 'Science Fiction'}]",http://www.thedivergentseries.movie/#divergent,157350,tt1840309,['US'],en,Divergent,"In a world divided into factions based on personality types, Tris learns that she's been classified as Divergent and won't fit in. When she discovers a plot to destroy Divergents, Tris and the mysterious Four must find out what makes Divergents dangerous before it's too late.",63.878,/aNh4Q3iuPKDMPi2SL7GgOpiLukX.jpg,"[{'id': 491, 'logo_path': '/5LvDUt3KmvRnXQ4NrdWJYHeuA8J.png', 'name': 'Summit Entertainment', 'origin_country': 'US'}, {'id': 14440, 'logo_path': '/5QbaGiuxc91D6qf75JZGX6OKXoU.png', 'name': 'Red Wagon Entertainment', 'origin_country': 'US'}]","[{'iso_3166_1': 'US', 'name': 'United States of America'}]",2014-03-14,288885818,139,"[{'english_name': 'English', 'iso_639_1': 'en', 'name': 'English'}]",Released,What makes you different makes you dangerous.,Divergent,False,6.916,12792,283579.0,Divergent Collection,/nXuCj7NcsC2bPJlwD6t2l9ZTDnt.jpg,/51XPQ6WXQDRUu9YoujqSc10OQp2.jpg
False,/2fswjyrY3GEzeoVn6mF8pNeNcgf.jpg,,150000000,"[{'id': 18, 'name': 'Drama'}, {'id': 14, 'name': 'Fantasy'}, {'id': 10749, 'name': 'Romance'}]",http://www.benjaminbutton.com/,4922,tt0421715,['US'],en,The Curious Case of Benjamin Button,"Born under unusual circumstances, Benjamin Button springs into being as an elderly man in a New Orleans nursing home and ages in reverse. Twelve years after his birth, he meets Daisy, a child who flits in and out of his life as she grows up to be a dancer. Though he has all sorts of unusual adventures over the course of his life, it is his relationship with Daisy, and the hope that they will come together at the right time, that drives Benjamin forward.",48.698,/26wEWZYt6yJkwRVkjcbwJEFh9IS.jpg,"[{'id': 4, 'logo_path': '/gz66EfNoYPqHTYI4q9UEN4CbHRc.png', 'name': 'Paramount Pictures', 'origin_country': 'US'}, {'id': 174, 'logo_path': '/zhD3hhtKB5qyv7ZeL4uLpNxgMVU.png', 'name': 'Warner Bros. Pictures', 'origin_country': 'US'}, {'id': 862, 'logo_path': '/vdK6ZhC2CSW36j0VPEavRxOpbEg.png', 'name': 'The Kennedy/Marshall Company', 'origin_country': 'US'}]","[{'iso_3166_1': 'US', 'name': 'United States of America'}]",2008-12-25,335800000,166,"[{'english_name': 'English', 'iso_639_1': 'en', 'name': 'English'}]",Released,"Life isn't measured in minutes, but in moments.",The Curious Case of Benjamin Button,False,7.591,12787,,,,
False,/bMiOfPhplZu1Lql3hGTRV087QA.jpg,,160000000,"[{'id': 28, 'name': 'Action'}, {'id': 878, 'name': 'Science Fiction'}, {'id': 12, 'name': 'Adventure'}]",https://www.20thcenturystudios.com/movies/x-men-first-class,49538,tt1270798,['US'],en,X-Men: First Class,"Before Charles Xavier and Erik Lensherr took the names Professor X and Magneto, they were two young men discovering their powers for the first time. Before they were arch-enemies, they were closest of friends, working together with other mutants (some familiar, some new), to stop the greatest threat the world has ever known.",1.877,/hNEokmUke0dazoBhttFN0o3L7Xv.jpg,"[{'id': 431, 'logo_path': '/6dcR1MbRqYgt3jUVYxkHe68GFnZ.png', 'name': ""The Donners' Company"", 'origin_country': 'US'}, {'id': 9168, 'logo_path': '/hQNXrYIuyLRxMSBuGHk0GX7CCBS.png', 'name': 'Bad Hat Harry Productions', 'origin_country': 'US'}, {'id': 25, 'logo_path': '/qZCc1lty5FzX30aOCVRBLzaVmcp.png', 'name': '20th Century Fox', 'origin_country': 'US'}, {'id': 7505, 'logo_path': '/837VMM4wOkODc1idNxGT0KQJlej.png', 'name': 'Marvel Entertainment', 'origin_country': 'US'}]","[{'iso_3166_1': 'US', 'name': 'United States of America'}]",2011-06-01,353624124,132,"[{'english_name': 'German', 'iso_639_1': 'de', 'name': 'Deutsch'}, {'english_name': 'English', 'iso_639_1': 'en', 'name': 'English'}, {'english_name': 'Spanish', 'iso_639_1': 'es', 'name': 'Español'}, {'english_name': 'French', 'iso_639_1': 'fr', 'name': 'Français'}, {'english_name': 'Russian', 'iso_639_1': 'ru', 'name': 'Pусский'}]",Released,Witness the moment that will change our world.,X-Men: First Class,False,7.301,12739,748.0,X-Men Collection,/31rqs6ZxFdi5nWZZaFPIr17q8jt.jpg,/ykVHlrE3aSvHYeIXOrWDsYZ18vv.jpg
False,/iYLKMV7PIBtFmtygRrhSiyzcVsF.jpg,,150000000,"[{'id': 12, 'name': 'Adventure'}, {'id': 35, 'name': 'Comedy'}, {'id': 10751, 'name': 'Family'}, {'id': 16, 'name': 'Animation'}]",http://movies.disney.com/moana,277834,tt3521164,['US'],en,Moana,"In Ancient Polynesia, when a terrible curse incurred by Maui reaches an impetuous Chieftain's daughter's island, she answers the Ocean's call to seek out the demigod to set things right.",99.142,/9tzN8sPbyod2dsa0lwuvrwBDWra.jpg,"[{'id': 2, 'logo_path': '/wdrCwmRnLFJhEoH8GSfymY85KHT.png', 'name': 'Walt Disney Pictures', 'origin_country': 'US'}, {'id': 6125, 'logo_path': '/tzsMJBJZINu7GHzrpYzpReWhh66.png', 'name': 'Walt Disney Animation Studios', 'origin_country': 'US'}]","[{'iso_3166_1': 'US', 'name': 'United States of America'}]",2016-10-13,690860472,107,"[{'english_name': 'English', 'iso_639_1': 'en', 'name': 'English'}]",Released,The ocean is calling.,Moana,False,7.568,12629,1241984.0,Moana Collection,/hiGRhPYMKU8aXfxmSD7lqJNSzJG.jpg,/4OgaftFNqtE1UvfDDb2Eov7A5Rz.jpg
False,/9ly9pxGwiB6g5lIZXou2HKXl7ua.jpg,,15000000,"[{'id': 18, 'name': 'Drama'}, {'id': 53, 'name': 'Thriller'}, {'id': 80, 'name': 'Crime'}]",http://www.sonypictures.com/movies/drive/,64690,tt0780504,['US'],en,Drive,"Driver is a skilled Hollywood stuntman who moonlights as a getaway driver for criminals. Though he projects an icy exterior, lately he's been warming up to a pretty neighbor named Irene and her young son, Benicio. When Irene's husband gets out of jail, he enlists Driver's help in a million-dollar heist. The job goes horribly wrong, and Driver must risk his life to protect Irene and Benicio from the vengeful masterminds behind the robbery.",40.298,/602vevIURmpDfzbnv5Ubi6wIkQm.jpg,"[{'id': 7263, 'logo_path': '/auaadhBBcvvTDtmW2iJzOrEjfgO.png', 'name': 'FilmDistrict', 'origin_country': 'US'}, {'id': 2266, 'logo_path': '/owzVs2mguyyJ3vIn7EbgowpUPnk.png', 'name': 'Bold Films', 'origin_country': 'US'}, {'id': 2527, 'logo_path': '/osO7TGmlRMistSQ5JZusPhbKUHk.png', 'name': 'Marc Platt Productions', 'origin_country': 'US'}, {'id': 3263, 'logo_path': '/fvQzPr1XM8wq0qp8Rt7Z68rdhAZ.png', 'name': 'OddLot Entertainment', 'origin_country': 'US'}, {'id': 11337, 'logo_path': None, 'name': 'Motel Movies', 'origin_country': 'US'}, {'id': 46625, 'logo_path': None, 'name': 'Newbridge Film Capital', 'origin_country': ''}]","[{'iso_3166_1': 'US', 'name': 'United States of America'}]",2011-09-15,78100000,100,"[{'english_name': 'English', 'iso_639_1': 'en', 'name': 'English'}]",Released,There are no clean getaways.,Drive,False,7.583,12622,,,,
False,/kGzFbGhp99zva6oZODW5atUtnqi.jpg,,13000000,"[{'id': 18, 'name': 'Drama'}, {'id': 80, 'name': 'Crime'}]",,240,tt0071562,['US'],en,The Godfather Part II,"In the continuing saga of the Corleone crime family, a young Vito Corleone grows up in Sicily and in 1910s New York. In the 1950s, Michael Corleone attempts to expand the family business into Las Vegas, Hollywood and Cuba.",95.73,/hek3koDUyRQk7FIhPXsa6mT2Zc3.jpg,"[{'id': 4, 'logo_path': '/gz66EfNoYPqHTYI4q9UEN4CbHRc.png', 'name': 'Paramount Pictures', 'origin_country': 'US'}, {'id': 536, 'logo_path': None, 'name': 'The Coppola Company', 'origin_country': 'US'}, {'id': 70, 'logo_path': '/ueaENQkPcy8rlr5fGZVBXKOhlBh.png', 'name': 'American Zoetrope', 'origin_country': 'US'}]","[{'iso_3166_1': 'US', 'name': 'United States of America'}]",1974-12-20,102600000,202,"[{'english_name': 'English', 'iso_639_1': 'en', 'name': 'English'}, {'english_name': 'Italian', 'iso_639_1': 'it', 'name': 'Italiano'}, {'english_name': 'Latin', 'iso_639_1': 'la', 'name': 'Latin'}, {'english_name': 'Spanish', 'iso_639_1': 'es', 'name': 'Español'}]",Released,The rise and fall of the Corleone empire.,The Godfather Part II,False,8.572,12539,230.0,The Godfather Collection,/zqV8MGXfpLZiFVObLxpAI7wWonJ.jpg,/3WZTxpgscsmoUk81TuECXdFOD0R.jpg
False,/zQU667Vusc8wTXcst2Y8vFqld2P.jpg,,160000000,"[{'id': 28, 'name': 'Action'}, {'id': 12, 'name': 'Adventure'}, {'id': 878, 'name': 'Science Fiction'}]",http://www.thehungergames.movie/,131634,tt1951266,['US'],en,The Hunger Games: Mockingjay - Part 2,"With the nation of Panem in a full scale war, Katniss confronts President Snow in the final showdown. Teamed with a group of her closest friends – including Gale, Finnick, and Peeta – Katniss goes off on a mission with the unit from District 13 as they risk their lives to stage an assassination attempt on President Snow who has become increasingly obsessed with destroying her. The mortal traps, enemies, and moral choices that await Katniss will challenge her more than any arena she faced in The Hunger Games.",52.753,/ihOhtXO1MnKe3GLqM8FvdkPYQub.jpg,"[{'id': 1632, 'logo_path': '/cisLn1YAUuptXVBa0xjq7ST9cH0.png', 'name': 'Lionsgate', 'origin_country': 'US'}, {'id': 5420, 'logo_path': '/dlW4Kh5dNieKNURnymsu57y6fMf.png', 'name': 'Color Force', 'origin_country': 'US'}, {'id': 264, 'logo_path': '/fA90qwUKgPhMONqtwY60GaHRyrW.png', 'name': 'Studio Babelsberg', 'origin_country': 'DE'}]","[{'iso_3166_1': 'DE', 'name': 'Germany'}, {'iso_3166_1': 'US', 'name': 'United States of America'}]",2015-11-18,653428261,137,"[{'english_name': 'English', 'iso_639_1': 'en', 'name': 'English'}]",Released,The fire will burn forever.,The Hunger Games: Mockingjay - Part 2,False,6.9,12508,131635.0,The Hunger Games Collection,/fPer2U4uQT1dkXTUWODDaLECWoW.jpg,/Ipp7cegtub4t0mu7xaKLQkYoGc.jpg
False,/msCHK5Kh1YbdZ0zPJ2nzPUhhSN9.jpg,,4500000,"[{'id': 14, 'name': 'Fantasy'}, {'id': 18, 'name': 'Drama'}, {'id': 9648, 'name': 'Mystery'}]",,141,tt0246578,['US'],en,Donnie Darko,"After narrowly escaping a bizarre accident, a troubled teenager is plagued by visions of a large bunny rabbit that manipulates him to commit a series of crimes.",46.768,/6FKym4sm5LcqUC80HNpn2ejVoro.jpg,"[{'id': 19813, 'logo_path': None, 'name': 'Flower Films', 'origin_country': 'US'}, {'id': 5367, 'logo_path': None, 'name': 'Gaylord Films', 'origin_country': ''}, {'id': 3334, 'logo_path': None, 'name': 'Adam Fields Productions', 'origin_country': ''}, {'id': 185, 'logo_path': None, 'name': 'Pandora Cinema', 'origin_country': ''}]","[{'iso_3166_1': 'US', 'name': 'United States of America'}]",2001-01-19,7500000,114,"[{'english_name': 'English', 'iso_639_1': 'en', 'name': 'English'}]",Released,"28 days, 6 hours, 42 minutes, 12 seconds... that is when the world will end.",Donnie Darko,False,7.773,12464,178106.0,Darko Collection,/f3DaaNRpyeZawist5Qt21hlzL2I.jpg,/hja7IzXp6how8eD1WHriI386TGY.jpg
False,/odblUdMERDmhQ4ei9Ja8tRZ4br6.jpg,,18000000,"[{'id': 12, 'name': 'Adventure'}, {'id': 28, 'name': 'Action'}]",http://www.indianajones.com,85,tt0082971,['US'],en,Raiders of the Lost Ark,"When Dr. Indiana Jones – the tweed-suited professor who just happens to be a celebrated archaeologist – is hired by the government to locate the legendary Ark of the Covenant, he finds himself up against the entire Nazi regime.",73.776,/ceG9VzoRAVGwivFU403Wc3AHRys.jpg,"[{'id': 4, 'logo_path': '/gz66EfNoYPqHTYI4q9UEN4CbHRc.png', 'name': 'Paramount Pictures', 'origin_country': 'US'}, {'id': 1, 'logo_path': '/tlVSws0RvvtPBwViUyOFAO0vcQS.png', 'name': 'Lucasfilm Ltd.', 'origin_country': 'US'}]","[{'iso_3166_1': 'US', 'name': 'United States of America'}]",1981-06-12,389925971,115,"[{'english_name': 'English', 'iso_639_1': 'en', 'name': 'English'}, {'english_name': 'Spanish', 'iso_639_1': 'es', 'name': 'Español'}, {'english_name': 'German', 'iso_639_1': 'de', 'name': 'Deutsch'}, {'english_name': 'Hebrew', 'iso_639_1': 'he', 'name': 'עִבְרִית'}, {'english_name': 'Arabic', 'iso_639_1': 'ar', 'name': 'العربية'}, {'english_name': 'Nepali', 'iso_639_1': 'ne', 'name': ''}]",Released,"If adventure has a name, it must be Indiana Jones!",Raiders of the Lost Ark,False,7.928,12462,84.0,Indiana Jones Collection,/yJgGZ8YtSIUuTIwYBCs1TjcVrg4.jpg,/6kh59mZizZsttZPR0HAdXk6Ve2n.jpg
False,/4HWAQu28e2yaWrtupFPGFkdNU7V.jpg,,40000000,"[{'id': 35, 'name': 'Comedy'}, {'id': 80, 'name': 'Crime'}, {'id': 9648, 'name': 'Mystery'}]",https://www.lionsgate.com/movies/knives-out,546554,tt8946378,['US'],en,Knives Out,"When renowned crime novelist Harlan Thrombey is found dead at his estate just after his 85th birthday, the inquisitive and debonair Detective Benoit Blanc is mysteriously enlisted to investigate. From Harlan's dysfunctional family to his devoted staff, Blanc sifts through a web of red herrings and self-serving lies to uncover the truth behind Harlan's untimely death.",60.568,/pThyQovXQrw2m0s9x82twj48Jq4.jpg,"[{'id': 1632, 'logo_path': '/cisLn1YAUuptXVBa0xjq7ST9cH0.png', 'name': 'Lionsgate', 'origin_country': 'US'}, {'id': 2531, 'logo_path': '/9MfCJ2G6Nrf9yyRj4tAgPmMiDcn.png', 'name': 'MRC', 'origin_country': 'US'}, {'id': 37871, 'logo_path': '/aUOo1S2AabqQnRrXK6XuObWPDyK.png', 'name': 'T-Street', 'origin_country': 'US'}]","[{'iso_3166_1': 'US', 'name': 'United States of America'}]",2019-11-27,312897920,131,"[{'english_name': 'Spanish', 'iso_639_1': 'es', 'name': 'Español'}, {'english_name': 'English', 'iso_639_1': 'en', 'name': 'English'}]",Released,"Hell, any of them could have done it.",Knives Out,False,7.846,12437,722971.0,Knives Out Collection,/hAEATQo1enoasXMuSbeqw67E7N2.jpg,/G7qYINSq5xyDd0I0zn3DpAssA0.jpg
False,/ig7qUy7drkEFZNCK7gi0hMn1WMN.jpg,,180000000,"[{'id': 28, 'name': 'Action'}, {'id': 878, 'name': 'Science Fiction'}, {'id': 12, 'name': 'Adventure'}]",https://www.warnerbros.com/movies/pacific-rim,68726,tt1663662,['US'],en,Pacific Rim,"Using massive piloted robots to combat the alien threat, earth's survivors take the fight to the invading alien force lurking in the depths of the Pacific Ocean. Nearly defenseless in the face of the relentless enemy, the forces of mankind have no choice but to turn to two unlikely heroes who now stand as earth's final hope against the mounting apocalypse.",64.9,/mmznhaQDwlHWpUwKuNxtQiubbmM.jpg,"[{'id': 101082, 'logo_path': '/zjAYU6sUmYaeFeJ1yWeaqzsWAz8.png', 'name': 'Double Dare You', 'origin_country': 'US'}, {'id': 923, 'logo_path': '/8M99Dkt23MjQMTTWukq4m5XsEuo.png', 'name': 'Legendary Pictures', 'origin_country': 'US'}]","[{'iso_3166_1': 'US', 'name': 'United States of America'}]",2013-07-11,411000000,131,"[{'english_name': 'Cantonese', 'iso_639_1': 'cn', 'name': '广州话 / 廣州話'}, {'english_name': 'English', 'iso_639_1': 'en', 'name': 'English'}, {'english_name': 'Japanese', 'iso_639_1': 'ja', 'name': '日本語'}, {'english_name': 'Russian', 'iso_639_1': 'ru', 'name': 'Pусский'}]",Released,"To fight monsters, we created monsters.",Pacific Rim,False,6.905,12423,363369.0,Pacific Rim Collection,/fmM3CboncxaslL2KMm4bl5oF7JE.jpg,/zg60Lc8JJm7j2lAlTtm0jvK6nZO.jpg
False,/vDQwbN2ymkMQ8ldL3Sc275FGBw3.jpg,,100000000,"[{'id': 10752, 'name': 'War'}, {'id': 36, 'name': 'History'}, {'id': 53, 'name': 'Thriller'}, {'id': 18, 'name': 'Drama'}]",https://www.1917.movie/,530915,tt8579674,['US'],en,1917,"At the height of the First World War, two young British soldiers must cross enemy territory and deliver a message that will stop a deadly attack on hundreds of soldiers.",56.005,/iZf0KyrE25z1sage4SYFLCCrMi9.jpg,"[{'id': 7, 'logo_path': '/vru2SssLX3FPhnKZGtYw00pVIS9.png', 'name': 'DreamWorks Pictures', 'origin_country': 'US'}, {'id': 7294, 'logo_path': '/kK4PRgceWp9KNrycD8xx8seWxYU.png', 'name': 'Reliance Entertainment', 'origin_country': 'IN'}, {'id': 114732, 'logo_path': '/tNCbisMxO5mX2X2bOQxHHQZVYnT.png', 'name': 'New Republic Pictures', 'origin_country': 'US'}, {'id': 1522, 'logo_path': '/8uaoEVgNxFH0R94O53gUiByahVr.png', 'name': 'Neal Street Productions', 'origin_country': 'GB'}, {'id': 103476, 'logo_path': '/1Wj9FXynetoCaNxUoBRvKxcKDsB.png', 'name': 'Mogambo Films', 'origin_country': 'ES'}, {'id': 121685, 'logo_path': '/bAO6cpKP9qoqHoDn4oUjWjZ5auq.png', 'name': 'Amblin Partners', 'origin_country': 'US'}]","[{'iso_3166_1': 'IN', 'name': 'India'}, {'iso_3166_1': 'ES', 'name': 'Spain'}, {'iso_3166_1': 'GB', 'name': 'United Kingdom'}, {'iso_3166_1': 'US', 'name': 'United States of America'}]",2019-12-25,394638258,119,"[{'english_name': 'English', 'iso_639_1': 'en', 'name': 'English'}, {'english_name': 'French', 'iso_639_1': 'fr', 'name': 'Français'}, {'english_name': 'German', 'iso_639_1': 'de', 'name': 'Deutsch'}]",Released,Time is the enemy,1917,False,7.991,12420,,,,
False,/bpV8wn48s82au37QyUJ51S7X2Vf.jpg,,10000000,"[{'id': 18, 'name': 'Drama'}]",http://www.miramax.com/movie/good-will-hunting,489,tt0119217,['US'],en,Good Will Hunting,"When professors discover that an aimless janitor is also a math genius, a therapist helps the young man confront the demons that are holding him back.",61.739,/z2FnLKpFi1HPO7BEJxdkv6hpJSU.jpg,"[{'id': 14, 'logo_path': '/m6AHu84oZQxvq7n1rsvMNJIAsMu.png', 'name': 'Miramax', 'origin_country': 'US'}, {'id': 2253, 'logo_path': None, 'name': 'Lawrence Bender Productions', 'origin_country': 'US'}, {'id': 23201, 'logo_path': None, 'name': 'Be Gentlemen Limited Partnership', 'origin_country': ''}]","[{'iso_3166_1': 'US', 'name': 'United States of America'}]",1997-12-05,225900000,127,"[{'english_name': 'English', 'iso_639_1': 'en', 'name': 'English'}]",Released,"Some people can never believe in themselves, until someone believes in them.",Good Will Hunting,False,8.158,12420,,,,
False,/3WK7p9EdZmmvB1IbB2Vw9Rf4lXH.jpg,,20000000,"[{'id': 18, 'name': 'Drama'}, {'id': 10749, 'name': 'Romance'}]",http://www.mebeforeyoumovie.net,296096,tt2674426,['US'],en,Me Before You,"A small town girl is caught between dead-end jobs. A high-profile, successful man becomes wheelchair bound following an accident. The man decides his life is not worth living until the girl is hired for six months to be his new caretaker. Worlds apart and trapped together by circumstance, the two get off to a rocky start. But the girl becomes determined to prove to the man that life is worth living and as they embark on a series of adventures together, each finds their world changing in ways neither of them could begin to imagine.",119.013,/Ia3dzj5LnCj1ZBdlVeJrbKJQxG.jpg,"[{'id': 12, 'logo_path': '/2ycs64eqV5rqKYHyQK0GVoKGvfX.png', 'name': 'New Line Cinema', 'origin_country': 'US'}, {'id': 5219, 'logo_path': None, 'name': 'Sunswept Entertainment', 'origin_country': 'US'}, {'id': 21, 'logo_path': '/usUnaYV6hQnlVAXP6r4HwrlLFPG.png', 'name': 'Metro-Goldwyn-Mayer', 'origin_country': 'US'}]","[{'iso_3166_1': 'US', 'name': 'United States of America'}]",2016-06-01,207945075,110,"[{'english_name': 'English', 'iso_639_1': 'en', 'name': 'English'}]",Released,Live boldly.,Me Before You,False,7.929,12418,,,,
False,/l45UqyARB3WxpYNuACjMjndpe85.jpg,,150000000,"[{'id': 16, 'name': 'Animation'}, {'id': 10751, 'name': 'Family'}, {'id': 35, 'name': 'Comedy'}, {'id': 14, 'name': 'Fantasy'}, {'id': 12, 'name': 'Adventure'}]",http://www.shrek2.com/,809,tt0298148,['US'],en,Shrek 2,"Shrek, Fiona, and Donkey set off to Far, Far Away to meet Fiona's mother and father, the Queen and King. But not everyone is happily ever after. Shrek and the King find it difficult to get along, and there's tension in the marriage. The Fairy Godmother discovers that Fiona has married Shrek instead of her son Prince Charming and plots to destroy their marriage.",107.357,/2yYP0PQjG8zVqturh1BAqu2Tixl.jpg,"[{'id': 521, 'logo_path': '/3BPX5VGBov8SDqTV7wC1L1xShAS.png', 'name': 'DreamWorks Animation', 'origin_country': 'US'}, {'id': 520, 'logo_path': '/pU7YTI9FfrICurXpl5V9TfCO0oJ.png', 'name': 'Pacific Data Images', 'origin_country': 'US'}]","[{'iso_3166_1': 'US', 'name': 'United States of America'}]",2004-05-19,935454538,92,"[{'english_name': 'English', 'iso_639_1': 'en', 'name': 'English'}]",Released,Once upon another time...,Shrek 2,False,7.282,12337,2150.0,Shrek Collection,/qNHZMe92A7Pyl46qUH29hVOtbSK.jpg,/gMWrKQjoTIpYjhc8SxZF20EDIES.jpg
False,/qLOXFr6WX5xIQtUvKVMU4lbxHmT.jpg,,50000000,"[{'id': 35, 'name': 'Comedy'}, {'id': 14, 'name': 'Fantasy'}]",https://www.uphe.com/movies/ted,72105,tt1637725,['US'],en,Ted,"John Bennett, a man whose childhood wish of bringing his teddy bear to life came true, now must decide between keeping the relationship with the bear or his girlfriend, Lori.",71.346,/1QVZXQQHCEIj8lyUhdBYd2qOYtq.jpg,"[{'id': 33, 'logo_path': '/3wwjVpkZtnog6lSKzWDjvw2Yi00.png', 'name': 'Universal Pictures', 'origin_country': 'US'}, {'id': 2531, 'logo_path': '/9MfCJ2G6Nrf9yyRj4tAgPmMiDcn.png', 'name': 'MRC', 'origin_country': 'US'}, {'id': 8789, 'logo_path': '/1smGq637YoNgkeBZXt7TAPDYGda.png', 'name': 'Fuzzy Door Productions', 'origin_country': 'US'}, {'id': 13778, 'logo_path': None, 'name': 'Bluegrass Films', 'origin_country': 'US'}, {'id': 44783, 'logo_path': None, 'name': 'Smart Entertainment', 'origin_country': 'US'}]","[{'iso_3166_1': 'US', 'name': 'United States of America'}]",2012-06-29,549368315,107,"[{'english_name': 'English', 'iso_639_1': 'en', 'name': 'English'}]",Released,Ted is coming.,Ted,False,6.435,12315,266672.0,Ted Collection,/byyIOLolJek05l4d1QAmLwtuyDO.jpg,/dGrNuWhapf8T0WH98xTC4LXgk1G.jpg
False,/riKyo85CmJU48ZaSMLpuDNTZHuE.jpg,,165000000,"[{'id': 10751, 'name': 'Family'}, {'id': 16, 'name': 'Animation'}, {'id': 35, 'name': 'Comedy'}, {'id': 12, 'name': 'Adventure'}]",http://disney.go.com/wreck-it-ralph,82690,tt1772341,['US'],en,Wreck-It Ralph,"Wreck-It Ralph is the 9-foot-tall, 643-pound villain of an arcade video game named Fix-It Felix Jr., in which the game's titular hero fixes buildings that Ralph destroys. Wanting to prove he can be a good guy and not just a villain, Ralph escapes his game and lands in Hero's Duty, a first-person shooter where he helps the game's hero battle against alien invaders. He later enters Sugar Rush, a kart racing game set on tracks made of candies, cookies and other sweets. There, Ralph meets Vanellope von Schweetz who has learned that her game is faced with a dire threat that could affect the entire arcade, and one that Ralph may have inadvertently started.",64.675,/zWoIgZ7mgmPkaZjG0102BSKFIqQ.jpg,"[{'id': 6125, 'logo_path': '/tzsMJBJZINu7GHzrpYzpReWhh66.png', 'name': 'Walt Disney Animation Studios', 'origin_country': 'US'}, {'id': 2, 'logo_path': '/wdrCwmRnLFJhEoH8GSfymY85KHT.png', 'name': 'Walt Disney Pictures', 'origin_country': 'US'}]","[{'iso_3166_1': 'US', 'name': 'United States of America'}]",2012-11-01,471222889,101,"[{'english_name': 'English', 'iso_639_1': 'en', 'name': 'English'}]",Released,The story of a regular guy just looking for a little wreck-ognition.,Wreck-It Ralph,False,7.341,12307,404825.0,Wreck-It Ralph Collection,/fB9IezOsfgfttFm9Q2kzkaOHAeE.jpg,/maHMw00WEuUzi4hoXxXQAGLntfH.jpg
False,/6aoyUbvu0419XLKLIMoH0TkEicH.jpg,,1900000,"[{'id': 80, 'name': 'Crime'}, {'id': 18, 'name': 'Drama'}]",,103,tt0075314,['US'],en,Taxi Driver,A mentally unstable Vietnam War veteran works as a night-time taxi driver in New York City where the perceived decadence and sleaze feed his urge for violent action.,49.236,/ekstpH614fwDX8DUln1a2Opz0N8.jpg,"[{'id': 46059, 'logo_path': None, 'name': 'Italo/Judeo Productions', 'origin_country': ''}, {'id': 46060, 'logo_path': None, 'name': 'Bill/Phillips', 'origin_country': ''}, {'id': 5, 'logo_path': '/71BqEFAF4V3qjjMPCpLuyJFB9A.png', 'name': 'Columbia Pictures', 'origin_country': 'US'}]","[{'iso_3166_1': 'US', 'name': 'United States of America'}]",1976-02-09,28579636,114,"[{'english_name': 'English', 'iso_639_1': 'en', 'name': 'English'}, {'english_name': 'Spanish', 'iso_639_1': 'es', 'name': 'Español'}]",Released,"On every street in every city, there's a nobody who dreams of being a somebody.",Taxi Driver,False,8.14,12297,,,,
