adult,backdrop_path,belongs_to_collection,budget,genres,homepage,id,imdb_id,origin_country,original_language,original_title,overview,popularity,poster_path,production_companies,production_countries,release_date,revenue,runtime,spoken_languages,status,tagline,title,video,vote_average,vote_count,belongs_to_collection.id,belongs_to_collection.name,belongs_to_collection.poster_path,belongs_to_collection.backdrop_path
False,/ubiu5Y7nP187ZFWUzjPj7Hgw6Go.jpg,,35000000,"[{'id': 35, 'name': 'Comedy'}]",https://www.warnerbros.com/movies/hangover,18785,tt1119646,['US'],en,The Hangover,"When three friends finally come to after a raucous night of bachelor-party revelry, they find a baby in the closet and a tiger in the bathroom. But they can't seem to locate their best friend, Doug – who's supposed to be tying the knot. Launching a frantic search for Doug, the trio perseveres through a nasty hangover to try to make it to the church on time.",90.836,/wTt2BoyAGhr0M00eR1ewVZyQoUq.jpg,"[{'id': 923, 'logo_path': '/8M99Dkt23MjQMTTWukq4m5XsEuo.png', 'name': 'Legendary Pictures', 'origin_country': 'US'}, {'id': 3527, 'logo_path': None, 'name': 'Green Hat Films', 'origin_country': 'US'}, {'id': 174, 'logo_path': '/zhD3hhtKB5qyv7ZeL4uLpNxgMVU.png', 'name': 'Warner Bros. Pictures', 'origin_country': 'US'}]","[{'iso_3166_1': 'US', 'name': 'United States of America'}]",2009-06-02,469310836,100,"[{'english_name': 'English', 'iso_639_1': 'en', 'name': 'English'}]",Released,Some guys just can't handle Vegas.,The Hangover,False,7.322,16879,86119.0,The Hangover Collection,/x8D6HXhmvdtPhM219J5Rc6ESagr.jpg,/3DFkmPwHEMUEkQzETXvUQH3314N.jpg
False,/dcvbs8z0GEXslC1kCT77x19XDeR.jpg,,52000000,"[{'id': 10402, 'name': 'Music'}, {'id': 18, 'name': 'Drama'}]",http://bohemianrhapsody.com,424694,tt1727824,"['US', 'GB']",en,Bohemian Rhapsody,"Singer Freddie Mercury, guitarist Brian May, drummer Roger Taylor and bass guitarist John Deacon take the music world by storm when they form the rock 'n' roll band Queen in 1970. Hit songs become instant classics. When Mercury's increasingly wild lifestyle starts to spiral out of control, Queen soon faces its greatest challenge yet – finding a way to keep the band together amid the success and excess.",45.849,/lHu1wtNaczFPGFDTrjCSzeLPTKN.jpg,"[{'id': 25, 'logo_path': '/qZCc1lty5FzX30aOCVRBLzaVmcp.png', 'name': '20th Century Fox', 'origin_country': 'US'}, {'id': 508, 'logo_path': '/7cxRWzi4LsVm4Utfpr1hfARNurT.png', 'name': 'Regency Enterprises', 'origin_country': 'US'}, {'id': 3281, 'logo_path': '/pfmb82VUfN9VKB1YuBSY69WVNVm.png', 'name': 'GK Films', 'origin_country': 'GB'}, {'id': 22213, 'logo_path': '/qx9K6bFWJupwde0xQDwOvXkOaL8.png', 'name': 'TSG Entertainment', 'origin_country': 'US'}]","[{'iso_3166_1': 'GB', 'name': 'United Kingdom'}, {'iso_3166_1': 'US', 'name': 'United States of America'}]",2018-10-24,918355943,135,"[{'english_name': 'English', 'iso_639_1': 'en', 'name': 'English'}]",Released,Fearless lives forever,Bohemian Rhapsody,False,7.983,16875,,,,
False,/qzUIOTk0E3F1zjvYjcBRTKUTgf9.jpg,,81000000,"[{'id': 80, 'name': 'Crime'}, {'id': 35, 'name': 'Comedy'}, {'id': 28, 'name': 'Action'}, {'id': 12, 'name': 'Adventure'}]",http://www.kingsmanmovie.com/,207703,tt2802144,['GB'],en,Kingsman: The Secret Service,The story of a super-secret spy organization that recruits an unrefined but promising street kid into the agency's ultra-competitive training program just as a global threat emerges from a twisted tech genius.,68.993,/r6q9wZK5a2K51KFj4LWVID6Ja1r.jpg,"[{'id': 25, 'logo_path': '/qZCc1lty5FzX30aOCVRBLzaVmcp.png', 'name': '20th Century Fox', 'origin_country': 'US'}, {'id': 5374, 'logo_path': '/pMUiImmYANjZUlZFiZMWziQDSs6.png', 'name': 'Marv', 'origin_country': 'GB'}, {'id': 78995, 'logo_path': None, 'name': 'Cloudy Productions', 'origin_country': 'GB'}, {'id': 22213, 'logo_path': '/qx9K6bFWJupwde0xQDwOvXkOaL8.png', 'name': 'TSG Entertainment', 'origin_country': 'US'}]","[{'iso_3166_1': 'GB', 'name': 'United Kingdom'}, {'iso_3166_1': 'US', 'name': 'United States of America'}]",2015-01-24,414351546,129,"[{'english_name': 'Arabic', 'iso_639_1': 'ar', 'name': 'العربية'}, {'english_name': 'English', 'iso_639_1': 'en', 'name': 'English'}]",Released,Manners maketh man.,Kingsman: The Secret Service,False,7.631,16739,391860.0,Kingsman Collection,/iR8L2XHA72wmYHc6O8LZmwV5hd5.jpg,/esDXPeq4eBLI5uIWH9QiyHkCUBB.jpg
False,/m4TUa2ciEWSlk37rOsjiSIvZDXE.jpg,,19000000,"[{'id': 16, 'name': 'Animation'}, {'id': 10751, 'name': 'Family'}, {'id': 14, 'name': 'Fantasy'}]",http://movies.disney.com/spirited-away,129,tt0245429,['JP'],ja,千と千尋の神隠し,"A young girl, Chihiro, becomes trapped in a strange new world of spirits. When her parents undergo a mysterious transformation, she must call upon the courage she never knew she had to free her family.",102.2,/39wmItIWsg5sZMyRUHLkWBcuVCM.jpg,"[{'id': 10342, 'logo_path': '/eS79pslnoKbWg7t3PMA9ayl0bGs.png', 'name': 'Studio Ghibli', 'origin_country': 'JP'}]","[{'iso_3166_1': 'JP', 'name': 'Japan'}]",2001-07-20,274925095,125,"[{'english_name': 'Japanese', 'iso_639_1': 'ja', 'name': '日本語'}]",Released,,Spirited Away,False,8.538,16615,,,,
False,/u2bZhH3nTf0So0UIC1QxAqBvC07.jpg,,150000000,"[{'id': 16, 'name': 'Animation'}, {'id': 10751, 'name': 'Family'}, {'id': 12, 'name': 'Adventure'}, {'id': 14, 'name': 'Fantasy'}]",http://movies.disney.com/frozen,109445,tt2294629,['US'],en,Frozen,"Young princess Anna of Arendelle dreams about finding true love at her sister Elsa’s coronation. Fate takes her on a dangerous journey in an attempt to end the eternal winter that has fallen over the kingdom. She's accompanied by ice delivery man Kristoff, his reindeer Sven, and snowman Olaf. On an adventure where she will find out what friendship, courage, family, and true love really means.",138.461,/mmWheq3cFI4tYrZDiATOkCNTqgK.jpg,"[{'id': 2, 'logo_path': '/wdrCwmRnLFJhEoH8GSfymY85KHT.png', 'name': 'Walt Disney Pictures', 'origin_country': 'US'}, {'id': 6125, 'logo_path': '/tzsMJBJZINu7GHzrpYzpReWhh66.png', 'name': 'Walt Disney Animation Studios', 'origin_country': 'US'}]","[{'iso_3166_1': 'US', 'name': 'United States of America'}]",2013-11-20,1274219009,102,"[{'english_name': 'English', 'iso_639_1': 'en', 'name': 'English'}]",Released,Only the act of true love will thaw a frozen heart.,Frozen,False,7.246,16549,386382.0,Frozen Collection,/13Op41T3cALJedrKqYPrlc3cIbO.jpg,/hKV4Xp0T31zpxlpPtETrWDxMSl1.jpg
False,/ddIkmH3TpR6XSc47jj0BrGK5Rbz.jpg,,150000000,"[{'id': 10752, 'name': 'War'}, {'id': 28, 'name': 'Action'}, {'id': 18, 'name': 'Drama'}]",http://www.dunkirkmovie.com/,374720,tt5013056,['US'],en,Dunkirk,"The story of the miraculous evacuation of Allied soldiers from Belgium, Britain, Canada and France, who were cut off and surrounded by the German army from the beaches and harbour of Dunkirk between May 26th and June 4th 1940 during World War II.",42.448,/b4Oe15CGLL61Ped0RAS9JpqdmCt.jpg,"[{'id': 174, 'logo_path': '/zhD3hhtKB5qyv7ZeL4uLpNxgMVU.png', 'name': 'Warner Bros. Pictures', 'origin_country': 'US'}, {'id': 9996, 'logo_path': '/3tvBqYsBhxWeHlu62SIJ1el93O7.png', 'name': 'Syncopy', 'origin_country': 'GB'}]","[{'iso_3166_1': 'GB', 'name': 'United Kingdom'}, {'iso_3166_1': 'US', 'name': 'United States of America'}]",2017-07-19,527000000,107,"[{'english_name': 'English', 'iso_639_1': 'en', 'name': 'English'}, {'english_name': 'French', 'iso_639_1': 'fr', 'name': 'Français'}, {'english_name': 'German', 'iso_639_1': 'de', 'name': 'Deutsch'}]",Released,"When 400,000 men couldn't get home, home came for them.",Dunkirk,False,7.453,16480,,,,
False,/aYcnDyLMnpKce1FOYUpZrXtgUye.jpg,,19000000,"[{'id': 80, 'name': 'Crime'}, {'id': 18, 'name': 'Drama'}, {'id': 53, 'name': 'Thriller'}]",,274,tt0102926,['US'],en,The Silence of the Lambs,"Clarice Starling is a top student at the FBI's training academy.  Jack Crawford wants Clarice to interview Dr. Hannibal Lecter, a brilliant psychiatrist who is also a violent psychopath, serving life behind bars for various acts of murder and cannibalism.  Crawford believes that Lecter may have insight into a case and that Starling, as an attractive young woman, may be just the bait to draw him out.",16.743,/uS9m8OBk1A8eM9I042bx8XXpqAq.jpg,"[{'id': 41, 'logo_path': '/xAot4SSOIHiWQ2WEnVXYGR1lce9.png', 'name': 'Orion Pictures', 'origin_country': 'US'}, {'id': 55072, 'logo_path': None, 'name': 'Strong Heart', 'origin_country': 'US'}]","[{'iso_3166_1': 'US', 'name': 'United States of America'}]",1991-02-14,272742922,119,"[{'english_name': 'English', 'iso_639_1': 'en', 'name': 'English'}]",Released,To enter the mind of a killer she must challenge the mind of a madman.,The Silence of the Lambs,False,8.347,16358,9743.0,The Hannibal Lecter Collection,/lTtnUnKVFLX10Ui19WGiL7CqZ1y.jpg,/qAtuvjXFkzUzFYn53I2vF1ueraA.jpg
False,/9tOkjBEiiGcaClgJFtwocStZvIT.jpg,,150000000,"[{'id': 16, 'name': 'Animation'}, {'id': 12, 'name': 'Adventure'}, {'id': 10751, 'name': 'Family'}, {'id': 35, 'name': 'Comedy'}]",http://movies.disney.com/zootopia,269149,tt2948356,['US'],en,Zootopia,"Determined to prove herself, Officer Judy Hopps, the first bunny on Zootopia's police force, jumps at the chance to crack her first case - even if it means partnering with scam-artist fox Nick Wilde to solve the mystery.",106.161,/hlK0e0wAQ3VLuJcsfIYPvb4JVud.jpg,"[{'id': 6125, 'logo_path': '/tzsMJBJZINu7GHzrpYzpReWhh66.png', 'name': 'Walt Disney Animation Studios', 'origin_country': 'US'}, {'id': 2, 'logo_path': '/wdrCwmRnLFJhEoH8GSfymY85KHT.png', 'name': 'Walt Disney Pictures', 'origin_country': 'US'}]","[{'iso_3166_1': 'US', 'name': 'United States of America'}]",2016-02-11,1023784195,109,"[{'english_name': 'English', 'iso_639_1': 'en', 'name': 'English'}]",Released,Welcome to the urban jungle.,Zootopia,False,7.749,16356,1084247.0,Zootopia Collection,/u8597pdwSHOvcJQhP2cLi7a67ZW.jpg,/1WDssJDYInLA4Avg45lgy3WM6Ly.jpg
False,/79bJL9ydAMYVltuNTt4VhxORqIz.jpg,,63000000,"[{'id': 12, 'name': 'Adventure'}, {'id': 878, 'name': 'Science Fiction'}]",http://www.jurassicpark.com/,329,tt0107290,['US'],en,Jurassic Park,"A wealthy entrepreneur secretly creates a theme park featuring living dinosaurs drawn from prehistoric DNA. Before opening day, he invites a team of experts and his two eager grandchildren to experience the park and help calm anxious investors. However, the park is anything but amusing as the security systems go off-line and the dinosaurs escape.",40.883,/8nSi7W1pG1KgqHS9kp3EsGoeKtA.jpg,"[{'id': 33, 'logo_path': '/3wwjVpkZtnog6lSKzWDjvw2Yi00.png', 'name': 'Universal Pictures', 'origin_country': 'US'}, {'id': 56, 'logo_path': '/cEaxANEisCqeEoRvODv2dO1I0iI.png', 'name': 'Amblin Entertainment', 'origin_country': 'US'}]","[{'iso_3166_1': 'US', 'name': 'United States of America'}]",1993-06-11,920100000,127,"[{'english_name': 'English', 'iso_639_1': 'en', 'name': 'English'}, {'english_name': 'Spanish', 'iso_639_1': 'es', 'name': 'Español'}]",Released,An adventure 65 million years in the making.,Jurassic Park,False,7.951,16329,328.0,Jurassic Park Collection,/qIm2nHXLpBBdMxi8dvfrnDkBUDh.jpg,/njFixYzIxX8jsn6KMSEtAzi4avi.jpg
False,/VuukZLgaCrho2Ar8Scl9HtV3yD.jpg,,116000000,"[{'id': 878, 'name': 'Science Fiction'}, {'id': 28, 'name': 'Action'}]",https://www.sonypictures.com/movies/venom,335983,tt1270797,['US'],en,Venom,"Investigative journalist Eddie Brock attempts a comeback following a scandal, but accidentally becomes the host of Venom, a violent, super powerful alien symbiote. Soon, he must rely on his newfound powers to protect the world from a shadowy organization looking for a symbiote of their own.",238.594,/2uNW4WbgBXL25BAbXGLnLqX71Sw.jpg,"[{'id': 53462, 'logo_path': '/nx8B3Phlcse02w86RW4CJqzCnfL.png', 'name': 'Matt Tolmach Productions', 'origin_country': 'US'}, {'id': 84041, 'logo_path': '/nw4kyc29QRpNtFbdsBHkRSFavvt.png', 'name': 'Pascal Pictures', 'origin_country': 'US'}, {'id': 7505, 'logo_path': '/837VMM4wOkODc1idNxGT0KQJlej.png', 'name': 'Marvel Entertainment', 'origin_country': 'US'}, {'id': 81620, 'logo_path': '/7LkIVuWBVScdujpKhBPx1TMnPQE.png', 'name': 'Tencent Pictures', 'origin_country': 'CN'}, {'id': 14439, 'logo_path': None, 'name': 'Arad Productions', 'origin_country': 'US'}, {'id': 5, 'logo_path': '/71BqEFAF4V3qjjMPCpLuyJFB9A.png', 'name': 'Columbia Pictures', 'origin_country': 'US'}]","[{'iso_3166_1': 'CN', 'name': 'China'}, {'iso_3166_1': 'US', 'name': 'United States of America'}]",2018-09-28,856085151,112,"[{'english_name': 'Mandarin', 'iso_639_1': 'zh', 'name': '普通话'}, {'english_name': 'English', 'iso_639_1': 'en', 'name': 'English'}, {'english_name': 'Malay', 'iso_639_1': 'ms', 'name': 'Bahasa melayu'}]",Released,The world has enough Superheroes.,Venom,False,6.833,16146,558216.0,Venom Collection,/aC1yeoBdQL0fukiKrEAFocJ572O.jpg,/vq340s8DxA5Q209FT8PHA6CXYOx.jpg
False,/yCnJT53HMXAK87xzPAdjdYhZ3JE.jpg,,40000000,"[{'id': 18, 'name': 'Drama'}, {'id': 9648, 'name': 'Mystery'}, {'id': 878, 'name': 'Science Fiction'}]",http://wwws.warnerbros.de/theprestige/,1124,tt0482571,"['US', 'GB']",en,The Prestige,"A mysterious story of two magicians whose intense rivalry leads them on a life-long battle for supremacy -- full of obsession, deceit and jealousy with dangerous and deadly consequences.",63.207,/bdN3gXuIZYaJP7ftKK2sU0nPtEA.jpg,"[{'id': 174, 'logo_path': '/zhD3hhtKB5qyv7ZeL4uLpNxgMVU.png', 'name': 'Warner Bros. Pictures', 'origin_country': 'US'}, {'id': 9195, 'logo_path': '/geK5QOBsXIPGHutKwXtYjMUyYSG.png', 'name': 'Touchstone Pictures', 'origin_country': 'US'}, {'id': 28, 'logo_path': '/7tRG0ZsmtptmzPMKupd1FZkjtnn.png', 'name': 'Newmarket Films', 'origin_country': 'US'}, {'id': 9996, 'logo_path': '/3tvBqYsBhxWeHlu62SIJ1el93O7.png', 'name': 'Syncopy', 'origin_country': 'GB'}]","[{'iso_3166_1': 'GB', 'name': 'United Kingdom'}, {'iso_3166_1': 'US', 'name': 'United States of America'}]",2006-10-17,109676311,130,"[{'english_name': 'English', 'iso_639_1': 'en', 'name': 'English'}]",Released,Are You Watching Closely?,The Prestige,False,8.204,16090,,,,
False,/ozVwXlfxqNsariipatGwa5px3Pm.jpg,,40000000,"[{'id': 28, 'name': 'Action'}, {'id': 878, 'name': 'Science Fiction'}]",https://www.uphe.com/movies/lucy,240832,tt2872732,['FR'],en,Lucy,"A woman, accidentally caught in a dark deal, turns the tables on her captors and transforms into a merciless warrior evolved beyond human logic.",56.854,/kRbpUTRNm6QbLQFPFWUcNC4czEm.jpg,"[{'id': 6896, 'logo_path': '/2Q89KvzxTKB5BAv9RqFIPI1qb7E.png', 'name': 'EuropaCorp', 'origin_country': 'FR'}, {'id': 104, 'logo_path': '/9aotxauvc9685tq9pTcRJszuT06.png', 'name': 'Canal+', 'origin_country': 'FR'}, {'id': 10611, 'logo_path': '/zQ4fGaEnNkWfSzyygXRcUZwPmDG.png', 'name': 'Ciné+', 'origin_country': 'FR'}, {'id': 356, 'logo_path': '/9tW5wZEGotn1Ei5pErA88m47XiD.png', 'name': 'TF1 Films Production', 'origin_country': 'FR'}]","[{'iso_3166_1': 'FR', 'name': 'France'}]",2014-07-25,458863600,89,"[{'english_name': 'Mandarin', 'iso_639_1': 'zh', 'name': '普通话'}, {'english_name': 'English', 'iso_639_1': 'en', 'name': 'English'}, {'english_name': 'French', 'iso_639_1': 'fr', 'name': 'Français'}, {'english_name': 'Spanish', 'iso_639_1': 'es', 'name': 'Español'}, {'english_name': 'Korean', 'iso_639_1': 'ko', 'name': '한국어/조선말'}]",Released,The average person uses 10% of their brain capacity. Imagine what she could do with 100%.,Lucy,False,6.455,16008,868884.0,Lucy Collection,/tUTIFGdfsdJ9U8iEc4FZUArWiYn.jpg,/hVYYMWELLoA2lGoouMI3RXQieag.jpg
False,/vv5a8u6e40kyH0Hp6HuamAgzRai.jpg,,200000000,"[{'id': 12, 'name': 'Adventure'}, {'id': 14, 'name': 'Fantasy'}, {'id': 28, 'name': 'Action'}]",https://movies.disney.com/pirates-of-the-caribbean-dead-mans-chest,58,tt0383574,['US'],en,Pirates of the Caribbean: Dead Man's Chest,Captain Jack Sparrow works his way out of a blood debt with the ghostly Davy Jones to avoid eternal damnation.,122.589,/uXEqmloGyP7UXAiphJUu2v2pcuE.jpg,"[{'id': 2, 'logo_path': '/wdrCwmRnLFJhEoH8GSfymY85KHT.png', 'name': 'Walt Disney Pictures', 'origin_country': 'US'}, {'id': 130, 'logo_path': '/c9dVHPOL3cqCr2593Ahk0nEKTEM.png', 'name': 'Jerry Bruckheimer Films', 'origin_country': 'US'}, {'id': 19936, 'logo_path': None, 'name': 'Second Mate Productions', 'origin_country': 'US'}]","[{'iso_3166_1': 'US', 'name': 'United States of America'}]",2006-07-06,1065700000,151,"[{'english_name': 'English', 'iso_639_1': 'en', 'name': 'English'}, {'english_name': 'Turkish', 'iso_639_1': 'tr', 'name': 'Türkçe'}, {'english_name': 'Greek', 'iso_639_1': 'el', 'name': 'ελληνικά'}, {'english_name': 'Mandarin', 'iso_639_1': 'zh', 'name': '普通话'}]",Released,Captain Jack is back!,Pirates of the Caribbean: Dead Man's Chest,False,7.365,15981,295.0,Pirates of the Caribbean Collection,/4KUJ38SsViJTsUmTRvXxerBNwAv.jpg,/wxgD3fB5lQ2sGJLog0rvXW049Pf.jpg
False,/zb6fM1CX41D9rF9hdgclu0peUmy.jpg,,22000000,"[{'id': 18, 'name': 'Drama'}, {'id': 36, 'name': 'History'}, {'id': 10752, 'name': 'War'}]",http://www.schindlerslist.com/,424,tt0108052,['US'],en,Schindler's List,The true story of how businessman Oskar Schindler saved over a thousand Jewish lives from the Nazis while they worked as slaves in his factory during World War II.,81.745,/sF1U4EUQS8YHUYjNl3pMGNIQyr0.jpg,"[{'id': 56, 'logo_path': '/cEaxANEisCqeEoRvODv2dO1I0iI.png', 'name': 'Amblin Entertainment', 'origin_country': 'US'}]","[{'iso_3166_1': 'US', 'name': 'United States of America'}]",1993-12-15,321365567,195,"[{'english_name': 'German', 'iso_639_1': 'de', 'name': 'Deutsch'}, {'english_name': 'Polish', 'iso_639_1': 'pl', 'name': 'Polski'}, {'english_name': 'Hebrew', 'iso_639_1': 'he', 'name': 'עִבְרִית'}, {'english_name': 'English', 'iso_639_1': 'en', 'name': 'English'}]",Released,"Whoever saves one life, saves the world entire.",Schindler's List,False,8.566,15955,,,,
False,/bdD39MpSVhKjxarTxLSfX6baoMP.jpg,,70000000,"[{'id': 18, 'name': 'Drama'}, {'id': 36, 'name': 'History'}, {'id': 10752, 'name': 'War'}]",,857,tt0120815,['US'],en,Saving Private Ryan,"As U.S. troops storm the beaches of Normandy, three brothers lie dead on the battlefield, with a fourth trapped behind enemy lines. Ranger captain John Miller and seven men are tasked with penetrating German-held territory and bringing the boy home.",58.17,/1wY4psJ5NVEhCuOYROwLH2XExM2.jpg,"[{'id': 7, 'logo_path': '/vru2SssLX3FPhnKZGtYw00pVIS9.png', 'name': 'DreamWorks Pictures', 'origin_country': 'US'}, {'id': 4, 'logo_path': '/gz66EfNoYPqHTYI4q9UEN4CbHRc.png', 'name': 'Paramount Pictures', 'origin_country': 'US'}, {'id': 56, 'logo_path': '/cEaxANEisCqeEoRvODv2dO1I0iI.png', 'name': 'Amblin Entertainment', 'origin_country': 'US'}, {'id': 762, 'logo_path': '/3T7EpKcS13viHu3WzRtQGvi9sTY.png', 'name': 'Mutual Film Company', 'origin_country': 'US'}]","[{'iso_3166_1': 'US', 'name': 'United States of America'}]",1998-07-24,481840909,169,"[{'english_name': 'Czech', 'iso_639_1': 'cs', 'name': 'Český'}, {'english_name': 'German', 'iso_639_1': 'de', 'name': 'Deutsch'}, {'english_name': 'English', 'iso_639_1': 'en', 'name': 'English'}, {'english_name': 'French', 'iso_639_1': 'fr', 'name': 'Français'}]",Released,The mission is a man.,Saving Private Ryan,False,8.2,15889,,,,
False,/tFlSDoWQsAZ2qjICKzfP5Yw6zM5.jpg,,125000000,"[{'id': 878, 'name': 'Science Fiction'}, {'id': 12, 'name': 'Adventure'}, {'id': 53, 'name': 'Thriller'}]",http://www.thehungergames.movie/,131631,tt1951265,['US'],en,The Hunger Games: Mockingjay - Part 1,Katniss Everdeen reluctantly becomes the symbol of a mass rebellion against the autocratic Capitol.,83.335,/4FAA18ZIja70d1Tu5hr5cj2q1sB.jpg,"[{'id': 1632, 'logo_path': '/cisLn1YAUuptXVBa0xjq7ST9cH0.png', 'name': 'Lionsgate', 'origin_country': 'US'}, {'id': 5420, 'logo_path': '/dlW4Kh5dNieKNURnymsu57y6fMf.png', 'name': 'Color Force', 'origin_country': 'US'}]","[{'iso_3166_1': 'US', 'name': 'United States of America'}]",2014-11-19,755356711,123,"[{'english_name': 'English', 'iso_639_1': 'en', 'name': 'English'}]",Released,Fire burns brighter in the darkness.,The Hunger Games: Mockingjay - Part 1,False,6.8,15799,131635.0,The Hunger Games Collection,/fPer2U4uQT1dkXTUWODDaLECWoW.jpg,/Ipp7cegtub4t0mu7xaKLQkYoGc.jpg
False,/34jW8LvjRplM8Pv06cBFDpLlenR.jpg,,160000000,"[{'id': 28, 'name': 'Action'}, {'id': 12, 'name': 'Adventure'}, {'id': 878, 'name': 'Science Fiction'}]",https://www.marvel.com/movies/spider-man-far-from-home,429617,tt6320628,['US'],en,Spider-Man: Far From Home,"Peter Parker and his friends go on a summer trip to Europe. However, they will hardly be able to rest - Peter will have to agree to help Nick Fury uncover the mystery of creatures that cause natural disasters and destruction throughout the continent.",83.441,/4q2NNj4S5dG2RLF9CpXsej7yXl.jpg,"[{'id': 420, 'logo_path': '/hUzeosd33nzE5MCNsZxCGEKTXaQ.png', 'name': 'Marvel Studios', 'origin_country': 'US'}, {'id': 84041, 'logo_path': '/nw4kyc29QRpNtFbdsBHkRSFavvt.png', 'name': 'Pascal Pictures', 'origin_country': 'US'}, {'id': 5, 'logo_path': '/71BqEFAF4V3qjjMPCpLuyJFB9A.png', 'name': 'Columbia Pictures', 'origin_country': 'US'}]","[{'iso_3166_1': 'US', 'name': 'United States of America'}]",2019-06-28,1131927996,129,"[{'english_name': 'Czech', 'iso_639_1': 'cs', 'name': 'Český'}, {'english_name': 'Dutch', 'iso_639_1': 'nl', 'name': 'Nederlands'}, {'english_name': 'English', 'iso_639_1': 'en', 'name': 'English'}, {'english_name': 'German', 'iso_639_1': 'de', 'name': 'Deutsch'}, {'english_name': 'Italian', 'iso_639_1': 'it', 'name': 'Italiano'}]",Released,It’s time to step up.,Spider-Man: Far From Home,False,7.42,15731,531241.0,Spider-Man (MCU) Collection,/plxMngMDZ3r2OSPn84UlyNHkmwi.jpg,/AvnqpRwlEaYNVL6wzC4RN94EdSd.jpg
False,/qAzYK4YPSWDc7aa4R43LcwRIAyb.jpg,,152000000,"[{'id': 28, 'name': 'Action'}, {'id': 12, 'name': 'Adventure'}, {'id': 878, 'name': 'Science Fiction'}]",https://www.marvel.com/movies/captain-marvel,299537,tt4154664,['US'],en,Captain Marvel,"The story follows Carol Danvers as she becomes one of the universe’s most powerful heroes when Earth is caught in the middle of a galactic war between two alien races. Set in the 1990s, Captain Marvel is an all-new adventure from a previously unseen period in the history of the Marvel Cinematic Universe.",48.25,/2D4lUKyn64Srs8QvVk0vv6KjvMG.jpg,"[{'id': 420, 'logo_path': '/hUzeosd33nzE5MCNsZxCGEKTXaQ.png', 'name': 'Marvel Studios', 'origin_country': 'US'}]","[{'iso_3166_1': 'US', 'name': 'United States of America'}]",2019-03-06,1131416446,124,"[{'english_name': 'English', 'iso_639_1': 'en', 'name': 'English'}]",Released,Higher. Further. Faster.,Captain Marvel,False,6.812,15729,623911.0,Captain Marvel Collection,/vMacLMNqwbP5eQ9KGpZE9ZqgCIk.jpg,/ubZUKycnQldt2umj0bPD2VwXDJM.jpg
False,/nLitXHcOD2jxwE6rq6sTi4ZMmo5.jpg,,150000000,"[{'id': 18, 'name': 'Drama'}, {'id': 878, 'name': 'Science Fiction'}, {'id': 53, 'name': 'Thriller'}]",http://iamlegend.warnerbros.com,6479,tt0480249,['US'],en,I Am Legend,"Robert Neville is a scientist who was unable to stop the spread of the terrible virus that was incurable and man-made. Immune, Neville is now the last human survivor in what is left of New York City and perhaps the world. For three years, Neville has faithfully sent out daily radio messages, desperate to find any other survivors who might be out there. But he is not alone.",67.105,/iPDkaSdKk2jRLTM65UOEoKtsIZ8.jpg,"[{'id': 174, 'logo_path': '/zhD3hhtKB5qyv7ZeL4uLpNxgMVU.png', 'name': 'Warner Bros. Pictures', 'origin_country': 'US'}, {'id': 79, 'logo_path': '/at4uYdwAAgNRKhZuuFX8ShKSybw.png', 'name': 'Village Roadshow Pictures', 'origin_country': 'US'}, {'id': 433, 'logo_path': '/iafkKMpcRfEXq9a4sQf0h6tg2E2.png', 'name': 'Weed Road Pictures', 'origin_country': 'US'}, {'id': 907, 'logo_path': '/ca5SWI5uvU985f8Kbb4xc8AmVWH.png', 'name': 'Overbrook Entertainment', 'origin_country': 'US'}, {'id': 437, 'logo_path': '/nu20mtwbEIhUNnQ5NXVhHsNknZj.png', 'name': 'Heyday Films', 'origin_country': 'GB'}, {'id': 333, 'logo_path': '/5xUJfzPZ8jWJUDzYtIeuPO4qPIa.png', 'name': 'Original Film', 'origin_country': 'US'}]","[{'iso_3166_1': 'US', 'name': 'United States of America'}]",2007-12-12,585410052,101,"[{'english_name': 'English', 'iso_639_1': 'en', 'name': 'English'}]",Released,The last man on Earth is not alone,I Am Legend,False,7.208,15728,945984.0,I Am Legend Collection,/kMWArwXFzMwCzRMRzJqZBC6d22A.jpg,/nvwI0ohPlC4M9rBMr3ZORFvcMQr.jpg
False,/oVD3ClJBoomSQHtnJPAlMfes8YD.jpg,,34000000,"[{'id': 28, 'name': 'Action'}, {'id': 80, 'name': 'Crime'}]",http://www.babydriver-movie.com,339403,tt3890160,['GB'],en,Baby Driver,"After being coerced into working for a crime boss, a young getaway driver finds himself taking part in a heist doomed to fail.",117.332,/rmnQ9jKW72bHu8uKlMjPIb2VLMI.jpg,"[{'id': 443, 'logo_path': '/wibNj4tELmsnCFlf5ldLik37Urr.png', 'name': 'Big Talk Studios', 'origin_country': 'GB'}, {'id': 10163, 'logo_path': '/16KWBMmfPX0aJzDExDrPxSLj0Pg.png', 'name': 'Working Title Films', 'origin_country': 'GB'}, {'id': 221513, 'logo_path': '/16KWBMmfPX0aJzDExDrPxSLj0Pg.png', 'name': 'Working Title Films', 'origin_country': 'US'}]","[{'iso_3166_1': 'GB', 'name': 'United Kingdom'}, {'iso_3166_1': 'US', 'name': 'United States of America'}]",2017-06-28,226945087,113,"[{'english_name': 'English', 'iso_639_1': 'en', 'name': 'English'}]",Released,All you need is one killer track.,Baby Driver,False,7.45,15720,726865.0,Baby Driver Collection,/iT2MoPGJ3arMUPEjTyTmi6C5ZFO.jpg,/5YdNKuMXZhoIEalATwealQS69WC.jpg
